judul,tanggal,isi,kategori
"6 Tentara Israel Bunuh Diri, Diduga Tekanan Mental Genosida di Gaza"," Sabtu, 23 Nov 2024 14:20 WIB ","Setidaknya enam tentara Israel telah bunuh diri dalam beberapa bulan terakhir, yang diduga akibat tekanan psikologis parah yang disebabkan genosida berkepanjangan di Gaza dan perang di Lebanon selatan.
Seperti dilansir TRT World, menurut investigasi Harian Israel Yedioth Ahronoth, jumlah bunuh diri tentara Israel mungkin lebih tinggi, karena militer Negeri Zionis itu belum merilis angka resmi, meskipun berjanji untuk mengungkapkannya pada akhir tahun ini.
Laporan Jumat (22/11) menyoroti krisis kesehatan mental yang lebih luas di dalam militer Israel yang terlibat dalam pembantaian massal warga Palestina dan penghancuran massal di Gaza, daerah kantong Palestina yang terkepung selama 413 hari terakhir.
Sejak 7 Oktober tahun lalu, militer Israel telah membunuh keluarga-keluarga di Gaza, menghancurkan permukiman, menggali kuburan massal, menghancurkan pemakaman, mengebom toko-toko dan bisnis, meratakan rumah sakit dan kamar mayat, menabrakkan tank dan buldoser ke mayat, menyiksa warga Palestina yang dipenjara dengan anjing dan listrik, melakukan eksekusi palsu terhadap tahanan, dan bahkan memperkosa banyak warga Palestina.
Menunjukkan perilaku sadis selama genosida, tentara Israel telah mengejek tahanan Palestina dengan mengklaim bahwa mereka sedang bermain sepak bola dengan kepala anak-anak mereka di Gaza.

Pasukan militer Israel telah menyiarkan langsung ratusan video tentara yang menjarah rumah-rumah Palestina, menghancurkan tempat tidur anak-anak, membakar rumah sambil tertawa, mengenakan pakaian dalam warga Palestina yang mengungsi, dan mencuri mainan anak-anak.
Dalam misi mereka untuk menghapus Palestina, pasukan militer Israel telah membunuh banyak bayi, petugas medis, atlet, dan jurnalis dalam jumlah yang belum pernah terjadi sebelumnya dalam perang mana pun di abad ini.
Namun sekarang, hal itu harus dibayar dengan harga yang mahal. Ribuan tentara Israel telah mencari bantuan dari klinik kesehatan mental militer atau psikolog lapangan, dengan sekitar sepertiga dari mereka yang terkena dampak menunjukkan gejala gangguan stres pascatrauma (PTSD).
Menurut penyelidikan, jumlah tentara Israel yang menderita trauma psikologis mungkin melebihi mereka yang mengalami luka fisik akibat perang.
Harian itu mengutip para ahli yang mengatakan bahwa tingkat penuh dari krisis kesehatan mental ini akan menjadi jelas setelah invasi militer berakhir dan pasukan kembali ke kehidupan normal.
Pada bulan Maret 2024, Lucian Tatsa-Laur, kepala departemen kesehatan mental militer Israel, mengatakan kepada Haaretz bahwa sekitar 1.700 tentara telah menerima perawatan psikologis.
Sejak itu, banyak laporan telah muncul yang menunjukkan bahwa ribuan tentara menderita masalah kesehatan mental karena penempatan yang diperpanjang di Gaza dan Lebanon selatan.",internasional
VIDEO: Air Mata Biden saat Gelar Makan Malam Bareng Staf Gedung Putih," Sabtu, 23 Nov 2024 12:41 WIB ","Presiden Joe Biden menggelar acara makan malam di South Lawn Gedung Putih pada Jumat (22/11).
Dalam acara itu, sang istri Jill Biden memberikan penghormatan atas pengabdian Biden dalam dunia politik AS.
Di momen itu, Joe Biden tampak berkaca-kaca hingga menyeka pipinya menggunakan tangan.
Para tamu undangan pun lantas melakukan toast sebagai bentuk penghormatan.
Biden akan turun dari jabatan sebagai Presiden AS pada Januari 2025 dan akan digantikan oleh Donald Trump.
Trump terpilih sebagai Presiden AS setelah mengalahkan Kamala Harris di Pilpres 2024.",internasional
Indonesia Dukung Penuh ICC soal Surat Perintah Penangkapan Netanyahu," Sabtu, 23 Nov 2024 12:35 WIB ","Kementerian Luar Negeri (Kemlu) Republik Indonesia mendukung penuh Mahkamah Pidana Internasional (ICC) usai merilis surat perintah penangkapan Perdana Menteri Israel Benjamin Netanyahu karena dugaan kejahatan perang di Palestina.
""Indonesia menegaskan kembali dukungan sepenuhnya terhadap semua inisiatif yang bertujuan untuk memastikan akuntabilitas atas kejahatan yang dilakukan oleh Israel di Palestina, termasuk yang ditempuh melalui International Criminal Court (ICC),"" demikian rilis resmi Kemlu, Sabtu (23/11).
Kemlu juga mengatakan surat perintah penangkapan itu merupakan langkah signifikan untuk mewujudkan keadilan karena kejahatan kemanusiaan dan kejahatan perang di Palestina.
Lebih lanjut, Kemlu meminta negara anggota yang ICC mematuhi perintah tersebut.

""Indonesia menekankan bahwa surat perintah penangkapan tersebut harus dilaksanakan sepenuhnya sesuai dengan hukum internasional,"" demikian pernyataan Kemlu di media sosial X, Sabtu (23/11).
Indonesia merupakan salah satu negara yang mendukung dan ikut memperjuangkan kemerdekaan Palestina. Pemerintah, melalui menteri luar negeri, sering berperan aktif dalam membela Palestina termasuk ikut melobi negara lain untuk mengakui Kemerdekaan Palestina.

Indonesia menegaskan kembali dukungan sepenuhnya terhadap semua inisiatif yang bertujuan untuk memastikan akuntabilitas atas kejahatan yang dilakukan oleh Israel di Palestina, termasuk yang ditempuh melalui International Criminal Court (ICC).Penerbitan surat perintah…

ICC mengeluarkan surat penangkapan itu pada Kamis (21/11). Tak cuma Netanyahu, surat penangkapan juga berlaku untuk eks Menteri Pertahanan Yoav Gallant.
""[Pengadilan] mengeluarkan surat perintah penangkapan untuk dua orang, Tn. Benjamin Netanyahu dan Tn. Yoav Gallant, atas kejahatan terhadap kemanusiaan dan kejahatan perang yang dilakukan setidaknya sejak 8 Oktober 2023 hingga setidaknya 20 Mei 2024, hari ketika Penuntutan mengajukan permohonan surat perintah penangkapan,"" demikian pernyataan ICC.
Kejahatan perang itu mencakup mencakup kelaparan sebagai metode peperangan,pembunuhan, penganiayaan, dan tindakan tidak manusiawi lain.
Israel melancarkan agresi ke Palestina sejak Oktober 2023. Selama operasi, mereka menggempur habis-habisan warga dan objek sipil di Jalur Gaza.
Imbas agresi Israel, setidaknya 44.000 orang di Palestina meninggal dan jutaan orang lainnya menjadi pengungsi.

Selama agresi, Israel juga membatasi bantuan kemanusiaan yang masuk ke Jalur Gaza. Di situasi normal warga di wilayah ini padahal perlu 700 bantuan truk kemanusiaan per hari.
Pembatasan bantuan kemanusiaan yang super ketat membuat warga Gaza masuk ke jurang krisis pangan hingga bencana kemanusiaan.",internasional
FOTO: Gunung Berapi Islandia Meletus 7 Kali Usai 'Tertidur' 800 Tahun,"Sabtu, 23 Nov 2024 12:20 WIB","Gunung berapi di Semenanjung Reykjanes Lyings, Islandia barat daya, dilaporkan sudah mengalami erupsi untuk ke-7 kalinya sepanjang 2024.",internasional
5 Rudal Israel Serang Permukiman Penduduk di Pusat Kota Beirut," Sabtu, 23 Nov 2024 11:52 WIB ","Lima rudal Israel menghantam bangunan perumahan di jantung Ibu Kota Lebanon, Beirut, Sabtu (23/11) waktu setempat.
Kantor Berita Nasional (NNA) Lebanon melaporkan bangunan yang hancur akibat serangan Israel itu berada di Jalan Al Mamoun, daerah Basta.
""Beirut, Ibu Kota, terbangun karena pembantaian yang mengerikan, saat pasukan udara musuh, Israel, menghancurkan total bangunan tempat tinggal 8 lantai dengan 5 rudal,"" demikian laporan NNA disitat dari AFP.

Jurnalis AFP di Beirut juga mendengar setidaknya ledakan besar di ibu kota ini.

Serangan itu terjadi usai Israel mengebom pinggiran selatan Beirut sepanjang hari. Imbas gempuran mereka, gedung 11 lantai hancur-lebur dan lima paramedis tewas.
Sejak pertengahan September, Israel menggempur habis-habisan Lebanon. Mereka mengklaim hanya menargetkan infrastruktur milisi Hizbullh.
Pasukan Israel juga menyerang fasilitas sipil seperti kamp pengungsian hingga perumahan warga.

Lalu pada 1 Oktober, Israel meluncurkan invasi ke Lebanon selatan. Mereka mengulangi alasan yang sama: menghancurkan Hizbullah. Namun, lagi-lagi Israel menyerang fasilitas sipil hingga pos pasukan penjaga perdamaian di Lebanon (UNIFIL).
Hingga kini lebih dari 3.500 orang meninggal karena bombardir pasukan Zionis di Lebanon.
Menghadapi gempuran yang nyaris tak pernah surut, Hizbullah tak tinggal diam. Milisi ini menyerang pasukan Israel di perbatasan. Kedua pihak ini pun bertempur sengit. Untuk meredam situasi, saat ini upaya gencatan senjata sedang dilakukan.",internasional
"Serang Ukraina Pakai Rudal Nuklir Oreshnik, Rusia Kirim Pesan ke AS"," Sabtu, 23 Nov 2024 11:50 WIB ","Kremlin mengatakan pada Jumat (22/11) bahwa serangan terhadap Ukraina menggunakan rudal balistik hipersonik yang baru dikembangkan merupakan pesan kepada Barat bahwa Moskow akan menanggapi dengan keras setiap tindakan Barat yang ""ceroboh"" dalam mendukung Ukraina.
Juru bicara Kremlin Dmitry Peskov berbicara sehari setelah Presiden Rusia Vladimir Putin mengatakan Moskow telah menembakkan rudal baru - Oreshnik atau Pohon Hazel - ke fasilitas militer Ukraina sebagai tanggapan atas serangan Kyiv terhadap Rusia dengan rudal buatan Amerika Serikat (AS) dan Inggris minggu ini, untuk pertama kalinya setelah AS memberikan persetujuannya.
""Pesan utamanya adalah bahwa keputusan dan tindakan sembrono negara-negara Barat yang memproduksi rudal, memasoknya ke Ukraina, dan kemudian berpartisipasi dalam serangan di wilayah Rusia tidak dapat dibiarkan tanpa reaksi dari pihak Rusia,"" kata Peskov kepada wartawan, seperti dilansir Reuters.
""Pihak Rusia telah dengan jelas menunjukkan kemampuannya, dan garis besar tindakan pembalasan lebih lanjut jika kekhawatiran kami tidak diperhitungkan telah diuraikan dengan cukup jelas,"" ujarnya.

Moskow menyebut Rusia menganggap penembakan rudal ATACMS dan Storm Shadow oleh Ukraina ke Rusia sebagai bukti keterlibatan langsung AS dan Inggris dalam perang tersebut. Dikatakan bahwa data penargetan satelit dan pemrograman aktual jalur penerbangan rudal harus dilakukan oleh personel militer NATO karena Kyiv sendiri tidak memiliki kemampuan tersebut.
Putin mengatakan Moskow telah menyerang perusahaan rudal dan pertahanan di kota Dnipro, Ukraina, tempat markas perusahaan rudal dan roket antariksa Pivdenmash, yang dikenal sebagai Yuzhmash oleh Rusia.
Kementerian Pertahanan Rusia mengatakan pada Jumat (22/11) bahwa semua hulu ledak rudal telah mengenai target mereka dan memuji apa yang dikatakannya sebagai penggunaan pertama yang berhasil dari rudal balistik hipersonik jarak menengah dengan hulu ledak konvensional dalam pertempuran.
Presiden Ukraina Volodymyr Zelenskiy mengatakan penggunaan rudal baru oleh Rusia merupakan ""eskalasi yang jelas dan parah"" dan telah menyerukan kecaman keras dari seluruh dunia.
Peskov mengatakan Rusia secara teknis tidak berkewajiban untuk memperingatkan Amerika Serikat tentang serangan itu karena rudal yang digunakan adalah rudal jarak menengah, bukan antarbenua, tetapi ia mengatakan Moskow telah memberi tahu AS 30 menit sebelum peluncuran.

Ia mengatakan Putin tetap terbuka untuk berdialog, tetapi pemerintahan Presiden AS Joe Biden yang akan segera lengser ""lebih suka melanjutkan jalur eskalasi"" dan mendesaknya untuk mengindahkan peringatan yang dikeluarkan Putin pada September lalu.
Putin mengatakan saat itu bahwa Barat akan langsung berperang dengan Rusia jika mengizinkan Ukraina menyerang wilayah Rusia dengan rudal jarak jauh buatan Barat, sebuah langkah yang menurutnya akan mengubah sifat dan cakupan konflik dan memaksa Moskow untuk mengambil ""keputusan yang tepat"" berdasarkan ancaman baru tersebut.
Dalam pernyataannya yang disiarkan televisi pada Kamis (21/11), Putin mengatakan bahwa Rusia telah menembakkan rudal barunya setelah Ukraina, dengan persetujuan dari pemerintahan Biden, telah menyerang Rusia dengan enam rudal ATACMS buatan AS pada Selasa (19/11) dan dengan rudal jelajah Storm Shadow Inggris dan HIMARS buatan AS pada Kamis (21/11).
Peskov mengatakan ia berharap AS telah menerima dan memahami pesan Moskow. ""Mengenai keterbukaan untuk berdialog, bahkan dalam pernyataan kemarin presiden menekankan kesiapannya untuk melakukan kontak apa pun - baik dengan tujuan untuk meredakan ketegangan, menghindari eskalasi lebih lanjut, maupun mencapai jalur damai,"" kata Peskov.
""Pernyataan kemarin (dari Putin) sangat komprehensif, jelas, dan logis. Kami tidak ragu bahwa pemerintahan saat ini di Washington memiliki kesempatan untuk membiasakan diri dengan pernyataan ini dan memahaminya.""",internasional
Prabowo Undang Raja Charles III Berkunjung ke Indonesia," Sabtu, 23 Nov 2024 11:40 WIB ","Presiden Prabowo Subianto mengundang Raja Inggris Charles III untuk berkunjung ke Indonesia. Undangan itu Prabowo sampaikan saat melawat ke Inggris dan bertemu Charles di Buckingham Palace, Inggris, pada Kamis (21/11) pagi.
""Presiden juga turut mengundang Raja Charles III untuk kembali berkunjung ke Indonesia,"" demikian pernyataan resmi Presiden Indonesia.
Charles pernah dua kali berkunjung ke Indonesia saat masih menjadi putra mahkota yakni pada 2008 dan 1989.
Pada 1989, Pangeran Charles berkunjung ke RI bersama istrinya Putri Diana. Saat itu, dia bertemu Presiden Soeharto dan sempat menanam pohon di Hutan Wanagama, Gunung Kidul, Yogyakarta.
Kemudian pada 2008, dia kembali mengunjungi RI dan bertemu dengan tokoh-tokoh Muslim.

Dalam pertemuan kali ini, Prabowo dan Charles membahas lingkungan yang menjadi perhatian bersama, termasuk energi transisi, perubahan iklim, dan pembangunan berkelanjutan.
Prabowo menegaskan Indonesia berkomitmen mendukung dan mendorong strategi kerja sama dengan Inggris guna mengakselerasi transformasi menuju energi hijau, mitigasi perubahan iklim, serta pengembangan ekonomi berbasis keberlanjutan.
Di kesempatan itu, Prabowo juga bercerita ke Charles pernah menempuh pendidikan di Inggris.
""Waktu muda saya pernah tinggal di sini, dan sekolah di sini, jadi itu dengan Raja,"" kata Prabowo dalam videonya di kanal YouTube Sekretariat Presiden.


Prabowo sempat mengenyam sekolah menengah atas di The American School di London, Inggris pada tahun 1966 silam.
Selama berkunjung ke Inggris, Presiden RI itu juga bertemu Perdana Menteri Keir Starmer di Downing Street 10, London.
Inggris merupakan negara terakhir yang dikunjungi Prabowo dalam rangkaian tur pertama dia ke luar negeri sebagai presiden.
Sebelum ke Inggris, Prabowo mengunjungi China, Amerika Serikat, menghadiri konferensi tingkat tinggi (KTT) APEC di Peru, serta menghadiri KTT G20 di Brasil.",internasional
Laos Ucapkan Duka atas Meninggalnya 6 Turis Keracunan Miras Oplosan," Sabtu, 23 Nov 2024 11:30 WIB ","Pemerintah Laos menyampaikan ucapan belasungkawa atas kematian enam turis asing di Vang Vieng. Kematian turis diduga karena keracunan miras oplosan yang mengandung metanol.
Ucapan tersebut disampaikan melalui situs Kementerian Luar Negeri Laos.
""Belasungkawa yang sedalam-dalamnya kepada keluarga korban,""tulis pemerintah Laos.
Pemerintah menjanjikan melakukan penyelidikan untuk menemukan penyebab insiden tersebut.


Sebelumnya, sebanyak enam turis meninggal karena dugaan keracunan metanol tempat kumpul para backpacker di Vang Vieng, mereka adalah dua warga negara Denmark, seorang warga negara Amerika, seorang warga negara Inggris, dan dua warga negara Australia.
Kantor Berita Resmi Laos (KPL) mengonfirmasi bahwa dua warga negara Denmark dan seorang warga negara AS meninggal dunia di Vang Vieng pada 13 November 2024.
""Dugaan penyebab kematian diyakini karena konsumsi minuman beralkohol yang tercemar,"" kata KPL.
""Para pejabat sedang dalam proses mengumpulkan informasi rinci, bukti, dan kesaksian saksi dan diharapkan untuk segera merilis pernyataan resmi,"" imbuhnya.

Polisi juga telah menahan manajer dan pemilik hostel tempat para wisatawan tersebut menginap. Namun diketahui tidak ada dakwaan yang diajukan.
Kedua remaja asal Melbourne, Australia itu dikabarkan tengah menikmati perjalanan backpacking tatkala mereka mendadak sakit usai keluar malam di Vang Vieng.
Kota pedesaan yang indah di Laos utara ini memang telah lama menjadi tempat backpacking yang populer.
Selama bertahun-tahun, kota ini terkenal sebagai tujuan utama untuk berpesta, terkenal dengan pesta minuman keras, mudahnya mendapatkan obat-obatan terlarang, dan kegiatan arung jeram yang menyebabkan serangkaian kematian.
",internasional
VIDEO: Detik-detik Rudal Israel Hantam Gedung di Beirut," Sabtu, 23 Nov 2024 11:23 WIB ","Ini adalah detik-detik saat serangan rudal Israel menghantam sebuah gedung di Beirut pada Jumat (22/11).
Warga pun mengabadikan momen saat gedung itu hancur dan memunculkan kepulan asap.
Konflik Israel dan Lebanon memanas sejak agresi ke Jalur Gaza terjadi pada Oktober 2023 lalu.
Hingga Kamis (21/11), jumlah korban tewas akibat serangan Israel ke Lebanon telah mencapai 3.583 orang.
Mayoritas korban tewas terjadi sejak eskalasi konflik meningkat pada September 2024.",internasional
3 Sosok Buronan ICC terkait 'Genosida' Israel di Jalur Gaza Palestina," Sabtu, 23 Nov 2024 11:20 WIB ","Mahkamah Kriminal Internasional (International Criminal Court/ICC) telah merilis surat penangkapan terhadap beberapa orang yang dianggap telah melakukan 'kejahatan perang' di Jalur Gaza Palestina pada Kamis (21/11).
Oleh karena itu, orang-orang tersebut kini menjadi buronan ICC dan bakal ditangkap jika mereka kedapatan berkunjung ke negara-negara anggota mahkamah internasional tersebut. Sebab, negara-negara anggota ICC berhak dan bisa menangkap mereka.

Berikut daftar buronan ICC terkait kasus kejahatan perang dan kejahatan terhadap kemanusiaan di Jalur Gaza berdasarkan keputusan mahkamah internasional tersebut:
Perdana Menteri Israel, Benjamin Netanyahu, merupakan salah satu orang yang kini menjadi buronan ICC. Sebab, PM berusia 75 tahun itu diduga telah melakukan kejahatan perang kepada warga Palestina di jalur Gaza.
Sejak diserang Hama pada 7 Oktober 2023, Netanyahu kian gencar memerintahkan pasukan militer Israel (IDF) untuk melakukan serangan-serangan mematikan ke wilayah Gaza.

Hingga saat ini, tercatat sudah ada 43 ribu lebih korban jiwa imbas serangan-serangan tersebut. Dari jumlah tersebut, sebagian korban terdiri anak-anak.
Baru-baru ini, militer Zionis juga telah melakukan serangan ke sejumlah target yang ada di Gaza. Pada 15 November lalu, misalnya, Israel membombardir sebuah sekolah yang menjadi kamp pengungsi di Gaza hingga menewaskan setidaknya 15 orang.
Berlanjut ke halaman berikutnya >>>

Selain PM Netanyahu, mantan Menteri Pertahanan Israel, Yoav Gallant, juga masuk dalam daftar buronan ICC saat ini. Sebab, sama dengan Netanyahu, ia juga diduga telah membantu Israel melakukan 'kejahatan perang' di jalur Gaza.
Gallant juga menjadi salah orang di balik serangan-serangan bengis yang dilakukan Israel di Gaza. Menurut ICC, ia juga menjadi orang yang ""secara sengaja dan sadar merampas hak-hak penduduk sipil di Gaza.""
Sebab, sejak 8 Oktober 2023 lalu, Gallant kerap memerintahkan militer Israel untuk menyerang ""objek-objek yang sangat diperlukan untuk kelangsungan hidup"" warga Gaza. Beberapa di antaranya, seperti makanan, air, dan obat-obatan dan perlengkapan medis, bahan bakar dan listrik.

Komandan sayap militer Hamas, Mohammed Diab Ibrahim Al-Masri atau Mohammed Deif, juga termasuk daftar buronan ICC. Sebab, ia dinilai telah melakukan 'kejahatan perang' di Israel pada 7 Oktober 2023 lalu.
Saat itu, Deif diduga menjadi dalang serangan Hamas ke Festival Musik Supernova. Serangan itulah yang memantik eskalasi konflik antara Israel dan Palestina yang hingga kini belum menemui titik damai.
Selain Netanyahu, Gallant, dan Deif, mantan pemimpin tertinggi Hamas, Ismail Haniyeh dan Yahya Sinwar sebetulnya juga masuk dalam daftar buronan ICC. Sebab, beberapa waktu lalu, ICC juga telah merilis surat penangkapan untuk kedua orang tersebut.
Namun, surat penangkapan itu kini sudah ditarik oleh ICC karena Haniyeh dan Sinwar sudah dikonfirmasi tewas dalam serangan Israel.",internasional
Beda Keuntungan Negara Partner dan Negara Anggota Tetap BRICS," Sabtu, 23 Nov 2024 10:10 WIB ","Indonesia telah resmi menjadi negara partner atau mitra forum ekonomi Brasil, Rusia, India, China, dan Afrika Selatan (BRICS).
Duta Besar Republik Indonesia untuk Rusia, Jose Antonio Morato Tavares, mengatakan kepada media Rusia TASS bahwa RI telah menerima undangan BRICS untuk menjadi negara partner.
""Ya [kami telah menerima undangan]. Ini adalah perkembangan positif. Sekarang kami sudah menjadi negara partner BRICS,"" kata Jose, seperti dikutip TASS, Rabu (20/11).
Menteri Luar Negeri RI Sugiono sebelumnya telah mengungkapkan bahwa Indonesia sudah mengajukan diri untuk bergabung dengan BRICS.

Juru bicara Kementerian Luar Negeri RI Roy Soemirat menjelaskan Indonesia saat ini telah menjadi interested country (negara yang tertarik).
Masih ada sejumlah kategori keanggotaan yang harus dilalui untuk mendapatkan keanggotaan penuh BRICS. Kategori itu sendiri antara lain interested country (negara yang berminat), prospective BRICS member state (calon negara anggota BRICS), invited BRICS member state (negara anggota BRICS yang telah mendapatkan undangan), dan BRICS member state (anggota tetap BRICS).
Seiring dengan ini, Roy mengatakan tujuan akhir Indonesia yakni menjadi anggota tetap BRICS.

Perbedaan antara negara anggota tetap dan negara partner BRICS terletak pada tingkat keterlibatan, kewenangan pengambilan keputusan, dan kedalaman kolaborasi.
Dilansir dari Focus Malaysia, negara anggota tetap atau penuh memiliki pengaruh besar dalam pengambilan keputusan serta memainkan peran langsung dalam menentukan agenda dan kebijakan BRICS.
Anggota tetap dapat berpartisipasi dalam pertemuan puncak tingkat tinggi, saat di mana keputusan penting mengenai kerja sama ekonomi, tata kelola internasional, dan strategi politik diputuskan.
Anggota penuh juga memiliki pengaruh yang lebih besar terhadap lembaga-lembaga BRICS seperti New Development Bank (NDB) dan Contingent Reserve Arrangement (CRA). Mereka dapat membentuk kebijakan dan proyek yang didanai oleh lembaga-lembaga ini.

Anggota tetap BRICS juga memperoleh manfaat dari perdagangan, investasi, dan kerja sama ekonomi yang lebih dalam dengan anggota lainnya seperti dengan membuat perjanjian perdagangan istimewa atau proyek infrastruktur bersama.
Anggota penuh juga memiliki pengaruh strategis terhadap perumusan kebijakan atas isu-isu global, seperti reformasi keuangan, kebijakan perubahan iklim, dan negosiasi geopolitik.
Lebih lanjut, anggota penuh memiliki keselarasan diplomatik dan politik yang lebih besar sebagai bagian dari proses pengambilan keputusan inti, yang memungkinkan mereka untuk beraliansi dengan negara-negara ekonomi besar dan mengadvokasi reformasi di lembaga-lembaga global seperti misalnya Dana Moneter Internasional atau Perserikatan Bangsa-Bangsa (PBB).
Negara partner atau mitra BRICS sementara itu tidak memiliki hak suara atau pengaruh besar atas keputusan dan kebijakan internal BRICS. Mereka memiliki kewenangan terbatas dalam pengambilan keputusan.

Meski tak punya akses terhadap inisiatif ekonomi dan pembangunan, negara partner tetap bisa mendapatkan manfaat dari kerja sama dalam proyek-proyek tertentu, investasi, serta mendapat akses terhadap sumber daya seperti pendanaan dari NDB untuk proyek infrastruktur dan pembangunan.
Negara mitra bisa terlibat secara fleksibel dalam BRICS tanpa perlu mengemban tanggung jawab maupun kewajiban seperti yang berlaku pada anggota tetap.
Negara-negara partner juga dapat bekerja sama dengan anggota BRICS mengenai isu-isu tertentu seperti perdagangan atau penelitian, namun tidak terikat pada komitmen politik.",internasional
AS Sebut Tentara Korut Kumpul di Rusia untuk Serbu Ukraina," Sabtu, 23 Nov 2024 09:54 WIB ","Kepala Departemen Pertahanan Amerika Serikat atau Pentagon Lloyd Austin memperkirakan ribuan tentara Korea Utara yang telah berkumpul di Rusia bakal segera memasuki medan perang melawan Ukraina.
Menurut Austin, sekitar 10 ribu tentara Korea Utara diyakini sudah berada di wilayah Kursk, Rusia, yang berbatasan dengan Ukraina. Para pasukan tentara Korut itu disebut telah diintegrasikan ke dalam formasi Rusia.

""Berdasarkan apa yang telah mereka latih, cara mereka diintegrasikan ke dalam formasi Rusia, saya sepenuhnya yakin mereka akan segera terlibat dalam pertempuran,"" ujar Austin di Fiji, Sabtu (23/11), melansir AFP.
Ia menambahkan dirinya belum melihat laporan yang signifikan mengenai pasukan Korut yang secara aktif terlibat dalam perang hingga saat ini.
Sebelumnya, pejabat pemerintah Korea Selatan dan sekelompok peneliti mengatakan Rusia telah menyediakan minyak, rudal anti udara dan bantuan ekonomi kepada Pyongyang sebagai imbalan atas pasukan yang dikirimkan oleh Washington dan Seoul.

Kyiv juga telah memperingatkan bahwa Moskow, bersama dengan tentara Korut, kini telah mengumpulkan 50 ribu tentara untuk merebut kembali beberapa bagian wilayah perbatasan yang direbut oleh pasukan Ukraina.
Ukraina merebut sebagian besar wilayah Kursk beberapa bulan lalu dalam sebuah serangan kilat. Hal itu bahkan ketika pasukannya terdesak di wilayah Donetsk, yang telah menanggung beban pertempuran selama hampir tiga tahun.
",internasional
