judul,tanggal,isi,kategori
Perkembangan Terkini Pengusutan Kasus Firli Bahuri," Minggu, 24 Nov 2024 06:16 WIB ","Kasus yang menjerat eks Ketua KPK Komjen Pol (Purn) Firli Bahuri di Polda Metro Jaya sudah berjalan lebih dari setahun sejak dia ditetapkan jadi tersangka pada 22 November 2023 lalu.
Dinilai 'mangkrak', Polda Metro Jaya dan Kejaksaan Tinggi (Kejati) DKI Jakarta digugat buntut penanganan kasus dugaan pemerasan yang menjerat eks Ketua KPK, Firli Bahuri itu tak kunjung tuntas.
Gugatan ini dilayangkan ke Pengadilan Negeri (PN) Jakarta Selatan oleh Lembaga Pengawasan, Pengawalan, dan Penegakan Hukum Indonesia (LP3HI) serta Masyarakat Anti Korupsi (MAKI) dan terdaftar dengan Nomor 116/Pid.Pra/2024/PN JKT.SEL.
Merespons gugatan tersebut, Kapolda Metro Jaya Irjen Pol Karyoto memastikan kasus itu akan diselesaikan.
""Tenang saja, nanti selesai,"" kata Karyoto di Polda Metro Jaya, Rabu (20/11).

Kabid Humas Polda Metro Jaya Kombes Pol Ade Ary Syam Indradi kepada wartawan, Sabtu (23/11), menyatakan pihaknya menghormati gugatan praperadilan tersebut.
""Tim penyidik menghormati adanya gugatan Praperadilan tersebut yang diajukan oleh MAKI sebagai pemohon I dan LP3HI sebagai pemohon II ke Pengadilan Negeri Jakarta Selatan,"" tuturnya.
""Dan penyidik atau kami Polda Metro Jaya menyikapi ini sebagai bentuk dukungan yang luar biasa kepada tim penyidik agar penyidikan perkara a quo, perkara tipikor ini yang saat ini dilakukan penyidik gabungan Subdit Tipikor Ditreskrimsus Polda Metro Jaya dengan Kortas atau Ditipikor sebelumnya, dilakukan secara profesional, transparan, akuntabel, dan untuk memberikan kepastian hukum,"" imbuh Ade Ary.
Sebelumnya, Polda Metro Jaya telah menetapkan Firli sebagai tersangka kasus pemerasan terhadap mantan Menteri Pertanian Syahrul Yasin Limpo (SYL) pada 22 November 2023 silam. Firli diduga melanggar Pasal 12 e dan atau Pasal 12 B dan atau Pasal 11 UU Tipikor juncto Pasal 65 KUHP dengan ancaman maksimal hukuman penjara seumur hidup.
Sejak ditetapkan sebagai tersangka hampir setahun lalu, Polda Metro Jaya belum menahan Firli.
Pada saat proses panggilan pemeriksaan di akhir 2023 lalu, Karyoto mengatakan bakal melayangkan surat panggilan kedua serta perintah penjemputan paksa ke Firli pasca mangkir dari panggilan pemeriksaannya di Gedung Bareskrim Polri sebagai tersangka.
""Hari ini panggilan pertama, akan kita layangkan panggilan kedua berikut sudah dipersiapkan surat perintah membawa,"" ujar Karyoto kepada wartawan di Monas, Jakarta Pusat, pada 21 Desember 2023.
Karyoto mengaku juga akan berkoordinasi dengan Direktur Reserse Kriminal Khusus Polda Metro Jaya Kombes Ade Safri Simanjuntak terkait tindak lanjut kasus pemerasan itu.
Karyoto menegaskan bahwa penyidik akan segera mengeluarkan surat penangkapan terhadap Firli apabila surat panggilan pemeriksaan kedua itu tetap diabaikan.
""Kalau itu (surat panggilan kedua) tidak diindahkan pasti kita keluarkan surat perintah penangkapan,"" katanya.
Pada awal tahun ini, Karyoto menyatakan akan segera menyelesaikan pengusutan kasus dugaan pemerasan Firli Bahuri ketika merespons pernyataan pakar hukum tata negara, Yusril Ihza Mahendra.
""Kalau saya, prinsipnya kasus akan segera saya selesaikan,"" kata Karyoto di Mapolda Metro Jaya, Jakarta Selatan, merespons pernyataan Yusril pada 16 Januari lalu.
Sehari sebelumnya, 15 Januari 2023, Yusril datang ke markas polisi untuk menjadi saksi a de charge atau meringankan bagi Firli dalam kasus itu. Pakar hukum tata negara yang kini menjadi Menko Hukum dan HAM itu meminta kasus tersebut dihentikan karena dianggap banyak kejanggalan dalam proses penyelidikan hingga penyidikan.
Menurut Yusril kala itu, bukti yang dikumpulkan polisi belum bisa membuktikan dugaan tindak pidana yang terjadi.
Kemudian pada 22 Maret 2024, Karyoto menegaskan bahwa kasus yang menjerat Firli Bahuri itu akan dituntaskan dan tak akan dihentikan proses penyidikannya.
Ia pun menyebut bahwa kasus tersebut akan selesai pada waktunya.
""Yang jelas saya katakan pada waktunya akan selesai, nanti lihat saja kedepan bagaimana,"" ujar Karyoto di Polda Metro Jaya, Jumat (22/3).
Meski demikian, lagi-lagi dia tak membeberkan dengan jelas mengenai perkembangan kasus tersebut.
""Kalau saya pastikan, saya akan selesaikan, kita sudah tinggal fase terakhir. Perkara itu jalannya dengan berkas, berkasnya ini memang sedang ada di kita dan dalam waktu yang tidak lama akan kita selesaikan,"" kata Karyoto.
Kabid Humas Polda Metro Jaya Ade ARy mengatakan Firli akan diperiksa kembali pada Kamis (28/11) mendatang untuk dimintai keterangan lagi oleh penyidik.
""Jadi penyidik telah menjadwalkan atau mengagendakan pemeriksaan atau permintaan keterangan tambahan pada tersangka FB pada hari Kamis, 28 November 2024, pukul 10 WIB di ruang pemeriksaan lantai 6 Bareskrim Polri,"" katanya ke wartawan, Sabtu.
""Ini merupakan surat panggilan 2 karena sebelumnya tidak dihadiri atas suatu alasan.  Kemudian surat panggilan yang ini sudah dikirim hari Rabu 2024,"" katanya.

",nasional
"Dijerat Pasal Pembunuhan Berencana, AKP Dadang Terancam Hukuman Mati"," Minggu, 24 Nov 2024 06:00 WIB ","Kabag Ops Polres Solok Selatan AKP Dadang Iskandar terancam hukuman mati atas kasus penembakan terhadap Kasat Reskrim Polres Solok Selatan AKP Riyanto Ulil Anshar.
Ia telah ditetapkan sebagai tersangka.
""Iya. Ancamannya hukuman mati, penjara seumur hidup dan penjara 20 tahun,"" kata Kabid Humas Polda Sumatera Barat, Kombes Dwi Sulistyawan, Minggu (24/11).
Direskrimum Polda Sumatera Barat Kombes Andry Kurniawan mengatakan AKP Dadang dijerat dengan pasal berlapis. Polisi menjerat pelaku dengan pasal pembunuhan berencana hingga pembunuhan.


""Berdasarkan bukti yang cukup, kita lakukan penahanan terhadap yang bersangkutan. Penyidik telah menjerat dengan pasal berlapis. Mulai dari pembunuhan. Berencana 340 KUHP, subsider 338 dan 351 ayat 3,"" katanya.
""Iya (hukuman mati) jika mengacu pada pasal 340 KUHP,"" lanjut dia.
Kasus penembakan yang dilakukan AKP Dadang kepada AKP Riyanto terjadi pada Jumat (22/11) dini hari. AKP Riyanto tewas dalam peristiwa tersebut.

Diduga penembakan tersebut berkaitan dengan bekingan tambang ilegal. Hingga kini polisi masih menyelidiki kasus tersebut.
Baca selengkapnya di sini.",nasional
BMKG Wanti-Wanti Cuaca Ekstrem Periode Natal-Tahun Baru," Minggu, 24 Nov 2024 04:42 WIB ","Kepala Badan Meteorologi, Klimatologi, dan Geofisika (BMKG) Dwikorita Karnawati meminta masyarakat mewaspadai potensi cuaca ekstrem selama periode Natal 2024 dan Tahun Baru 2025 (Nataru).
Kondisi tersebut dipicu oleh sejumlah faktor. Di antaranya, fenomena La Nina yang mengakibatkan potensi penambahan curah hujan hingga 20-40 persen. Fenomena ini akan berlangsung mulai akhir tahun 2024 hingga setidaknya April 2025.
Selain itu, tambah Dwikorira, terdapat pula dinamika atmosfer lain yang diprediksikan pada periode Nataru aktif bersamaan, seperti Madden-Julian Oscillation (MJO) dan Cold Surge yang bergerak dari daratan Asia (Siberia) menuju wilayah barat Indonesia yang juga berpotensi menambah intensitas dan volume curah hujan di berbagai wilayah Indonesia.
""Untuk itu, kami mewanti-wanti masyarakat untuk mewaspadai potensi cuaca ekstrem yang dapat berdampak pada bencana hidrometeorologi di wilayah Indonesia seperti banjir, banjir bandang, dan tanah longsor, khususnya pada periode Nataru 2024/2025,"" ungkap Dwikorita di Jakarta, Sabtu (23/11).

Himbauan ini, lanjut Dwikorita, juga ditujukan kepada perusahaan pelayaran, angkutan penyeberangan, dan nelayan mengingat fenomena cold surge juga dapat memicu gelombang tinggi di laut sehingga membahayakan keselamatan saat aktivitas pelayaran/penyeberangan serta penangkapan ikan.
""Peringatan dini ini disampaikan untuk mencegah terjadinya kecelakaan laut. Masyarakat bisa mengakses informasi cuaca 24 jam penuh melalui aplikasi @infobmkg. Silahkan akses informasi dari platform tersebut sebagai acuan dalam beraktivitas selama pekan Nataru. Disana juga terdapat informasi gempabumi dan lain sebagainya,"" imbuhnya.

",nasional
Polda Tegaskan Tak Ada Hambatan Usut Firli di Kasus Pemerasan SYL," Minggu, 24 Nov 2024 04:16 WIB ","Polda Metro Jaya memastikan tak ada hambatan dalam penanganan kasus dugaan pemerasan terhadap eks Mentan Syahrul Yasin Limpo (SYL) oleh mantan Ketua KPK Firli Bahuri.
Kabid Humas Polda Metro Jaya Kombes Ade Ary Syam Indradi menyampaikan kini kasus itu masih dalam proses pemenuhan berkas perkara dengan Kejati DKI Jakarta.
""Penyidik masih memenuhi petunjuk P19 dan hasil koordinasi dengan JPU pada kantor Kejaksaan Tinggi DKI Jakarta, progres penyidikannya sangat baik dan tidak ada kendala maupun hambatan sama sekali,"" kata Ade di Polda Metro Jaya, Sabtu (23/11).
Ade menyatakan Polda Metro terus berkoordinasi dengan Jaksa Penuntut Umum (JPU) di Kejari Jakarta dan terus secara intensif dalam rangka melengkapi berkas perkara.

Ia memastikan Polda Metro Jaya senantiasa profesional dalam menangani perkara ini.
Ade berjanji proses penanganan kasus ini akan berjalan secara transparan dan akuntabel.
""Serta bebas dari segala bentuk intervensi,"" ucapnya.
Firli ditetapkan sebagai tersangka oleh Polda Metro Jaya dalam kasus pemerasan terhadap eks Mentan Syahrul Yasin Limpo pada 22 November 2023 lalu.
Dalam kasus ini, Firli diduga melanggar Pasal 12 e dan atau Pasal 12 B dan atau Pasal 11 UU Tipikor juncto Pasal 65 KUHP dengan ancaman maksimal hukuman penjara seumur hidup.
Kurang lebih sudah setahun berstatus tersangka. Tetapi, tak ada perkembangan yang berarti dalam proses penyidikan yang dilakukan Subdit Tipidkor Ditreskrimsus Polda Metro Jaya.
Penyidik tercatat dua kali mengirimkan berkas perkara ke Kejati DKI Jakarta dan dua kali pula dikembalikan karena dinilai belum lengkap.

Pada Februari lalu, Firli tercatat sempat kembali dipanggil untuk diperiksa guna melengkapi berkas perkara sesuai petunjuk jaksa. Namun, dua kali ia tak hadir.
Di sisi lain, Polda Metro Jaya dan Kejaksaan Tinggi DKI Jakarta kini digugat ke Pengadilan Negeri Jakarta Selatan lantaran tak kunjung merampungkan kasus tersebut.
Gugatan dilayangkan ke Pengadilan Negeri (PN) Jakarta Selatan oleh Lembaga Pengawasan, Pengawalan, dan Penegakan Hukum Indonesia (LP3HI) serta Masyarakat Anti Korupsi (MAKI) dan terdaftar dengan nomor 116/Pid.Pra/2024/PN JKT.SEL.",nasional
Pramono-Rano Dinilai Samarkan PDIP Demi Gaet Pendukung Anies," Minggu, 24 Nov 2024 02:45 WIB ","Calon Gubernur Jakarta nomor urut 3, Pramono Anung-Rano Karno dinilai menyamarkan dukungan dari partainya sendiri, PDIP.
Mereka dinilai menghilangkan dukungan dari PDIP untuk memperoleh suara maksimal dari ceruk pendukung Anies Baswedan alias anak abah.

Pakar politik Universitas Jayabaya, Igor Dirgantara menilai hal itu juga karena faktor keberadaan Basuki Tjahja Purnama atau Ahok.
Ia berpendapat jika Pramono-Rano terkesan dekat dengan Ahok, justru mereka berpotensi kehilangan suara pendukung Anies.

""Pemilih DKI Jakarta, terutama pada kategori pemilih muslim dan pemilih perempuan masih kurang suka dengan Ahok karena kasus penistaan agama,"" kata Igor ketika dikonfirmasi, Sabtu (23/11).
Igor menduga dukungan loyalis Anies ke paslon di Pilgub Jakarta ini akan terpecah, ada yang ke Pramono-Rano dan juga RK-Suswono.

Ia pun berpandangan suara anak abah hari ini masuk dalam kategori pemilih mengambang.
Pada hari ini, Pramono-Rano menggelar kampanye akbar di Stadion Madya GBK, Jakarta. Ahok hadir ke sana.
Namun, Anies Baswedan absen pada hari ini. Pada kampanye akbar Pramono-Rano sebelumnya pada Kamis (21/11) lalu, Anies hadir.
Ahok mengatakan kemungkinan Anies sedang ada kegiatan lain pada hari ini.
Ahok membantah tak mau berdiri satu panggung dengan Anies yang merupakan rivalnya di Pilgub DKI 2017 silam.


""Dia katanya beliau ada kegiatan lain, karena kayak kemarin dia datang saya masih di Buton. Saya pun tadi pagi baru sampai jam 3 dari Buton,"" katanya mengutip dari Antara.
Ahok pun bersyukur pendukungnya, Ahokers dan pendukung Anies alias Anak Abah bersatu untuk mendukung Pramono-Rano.

",nasional
Khofifah Sebut Jatim Ibu Kota Indonesia Secara Defacto," Minggu, 24 Nov 2024 01:45 WIB ","Calon gubernur nomor urut 2 Khofifah Indar Parawansa mengatakan Jawa Timur adalah ibu kota baru Indonesia secara defacto. Ia pun mengaku sudah menyampaikannya ke Presiden RI Prabowo Subianto dan presiden terdahulu Joko Widodo.
Hal itu dikatakan Khofifah di hadapan ribuan relawannya saat kampanye terakhirnya bertajuk 'Dzikir, Sholawat dan Doa Bersama Menyambut Kemenangan Khofifah-Emil' di Jatim Expo, Surabaya, Sabtu (23/11).
Awalnya Khofifah mengatakan ribuan relawannya yang hadir adalah orang yang akan jadi penguat kemenangannya di Pilgub Jatim 2024. Sekaligus penguat terwujudnya visi dan misinya, Jatim Gerbang Baru Nusantara.
""Panjenengan (kalian) semua yang akan jadi penguat bagaimana Jatim menjadi gerbang baru nusantara,"" kata Khofifah.


Khofifah kemudian melanjutkan, karena pusat pemerintahan dipindah ke Ibu Kota Nusantara yang ada di Kalimantan Timur (Kaltim), maka Jatim akan jadi Ibu Kota Indonesia secara defacto, karena peran sentralnya.
""Kenapa [Jatim jadi] Gerbang Baru [Nusantara] ? Karena Ibu Kota Nusantara (IKN) di Kalimantan Timur. Beberapa kali saya sendiri menyampaikan baik di hadapan Presiden Jokowi saat itu, maupun di hadapan Presiden Prabowo, kalau IKN ada di Kaltim, maka secara defacto Ibu Kota Indonesia sesungguhnya ada di Jatim,"" ucap dia.

Khofifah dalam orasinya juga mengucapkan terima kasih kepada para ulama, parpol dan massa yang hadir. Ia zikir dan selawat yang dilantunkan bisa menguatkan kemenangannya bersama Emil dengan signifikan.
""Mudah-mudahan ini menguatkan kemenangan Khofifah-Emil secara signifikan,"" kata Khofifah.
Khofifah memohon doa dan dukungan agar kepemimpinan mereka bisa berlanjut ke periode kedua.
""Banyak kiai-kiai sepuh, bu nyai-bu nyai sepuh, memberikan doa menguatkan perjalanan kita untuk menjemput Indonesia Emas 2045,"" katanya.",nasional
"Kunjungan Negara Tuntas, Prabowo Kembali ke Tanah Air"," Minggu, 24 Nov 2024 01:15 WIB ","Presiden Republik Indonesia Prabowo Subianto telah menyelesaikan seluruh rangkaian kunjungan kenegaraannya dan telah bertolak kembali ke Tanah Air.
Dalam keterangan pers yang diterima dari Biro Pers Sekretariat Presiden, Sabtu (23/11), Presiden Prabowo beserta rombongannya lepas landas dari Presidential Flight, Abu Dhabi, PEA, sekitar pukul 17.30 waktu setempat.
Keberangkatan Presiden RI itu dilepas oleh beberapa pejabat tinggi negara baik perwakilan dari PEA yaitu Menteri Energi dan Infrastruktur PEA Suhail Mohamed Al Mazrouei dan Duta Besar PEA untuk Indonesia Abdulla Salem AlDhaheri.
Hadir juga pejabat negara dari Indonesia yang ikut melepas Presiden Prabowo di antaranya Duta Besar Indonesia untuk PEA Husin Bagis, dan Atase Pertahanan Republik Indonesia Brigjen TNI Muhammad Irawadi.

Presiden seharusnya tiba di Indonesia pada 24 November 2024. Dengan kembalinya Presiden ke Tanah Air, itu artinya Prabowo sudah menyelesaikan lawatannya ke sejumlah negara yang berlangsung sejak 8 November 2024.
Merangkum seluruh perjalanan Presiden Prabowo, sejak 8 November-23 November 2024, dia telah melakukan kunjungan ke enam negara dimulai dari lawatan ke China untuk bertemu Presiden Republik Rakyat Tiongkok Xi Jinping, dilanjutkan dengan pertemuan ke Amerika Serikat berjumpa Presiden AS Joe Biden.
Lalu setelahnya Prabowo melanjutkan perjalanan ke dua konferensi internasional yang pertama adalah KTT APEC di Peru, dan konferensi kedua ialah KTT G20 di Brasil.

Kunjungan kenegaraan tersebut dilanjutkan dengan pertemuan Presiden dengan Raja Charles III serta Perdana Menteri Inggris Keir Starmer, dan ditutup dengan pertemuan bersama Presiden Persatuan Emirat Arab (PEA) Sheikh Mohammed bin Zayed Al Nahyan (MBZ).
Dari semua kunjungan kenegaraan tersebut, Presiden Prabowo berhasil membawa banyak kerja sama di berbagai sektor yang diharapkan berdampak positif untuk berlangsungnya program-program prioritas Indonesia.",nasional
KPK Periksa Gubernur Bengkulu Rohidin Mersyah," Minggu, 24 Nov 2024 00:32 WIB ","Komisi Pemberantasan Korupsi (KPK) melakukan pemeriksaan terhadap Gubernur Bengkulu Rohidin Mersyah di Mako Polresta Bengkulu, Sabtu (23/11) malam.""Seperti yang rekan-rekan sudah tahu juga, terakhir tiba di Mako Polresta, mungkin saat ini sudah sedang dalam pemeriksaan KPK, tinggal tunggu berita saja,"" kata Kapolresta Bengkulu Kombes Pol Deddy Nata menjawab pertanyaan jurnalis terkait pemeriksaan Rohidin, di Bengkulu.Rohidin tiba di Mako Polresta Bengkulu sekitar pukul 22.50 WIB dengan tiga mobil yang digunakan KPK. Deddy Nata pun membenarkan Rohidin merupakan orang terakhir sampai di Mako Polresta Bengkulu yang dibawa KPK.""Ya memang benar Rohidin masuk. Kita tunggu perkembangan lebih lanjut (dari KPK) ya,"" kata Deddy.

KPK memakai ruangan Polresta Bengkulu untuk melakukan pemeriksaan terhadap Rohidin Mersyah dkk.""Ruangan kami memang yang dipakai (untuk pemeriksaan), ruangan Mako Polresta Bengkulu, tapi bukan ruangan Kapolresta,"" kata dia.Kemudian, Deddy juga membenarkan sejumlah pengacara dari orang yang diperiksa KPK juga ikut mendatangi Polrestabes Bengkulu.

""Ya pengacara juga sudah datang, tapi kami sampaikan bahwa tidak bisa masuk ke dalam, karena memang bukan kegiatan Polresta. Jadi Polresta hanya mengamankan, segala sesuatunya itu tanggung jawab dari KPK,"" ucap Deddy.
Sebelumnya KPK dikabarkan melakukan operasi tangkap tangan sejumlah pejabat di Bengkulu. Namun hingga kini belum ada keterangan resmi dari KPK terkait hal tersebut.",nasional
"Survei Pilgub Kalteng: Agustiar-Edy 45,3%, Ungguli 3 Paslon Lain"," Minggu, 24 Nov 2024 00:19 WIB ","Survei Poltracking Indonesia menyebutkan elektabilitas pasangan calon gubernur (cagub) dan calon wakil gubernur (cawagub) Kalimantan Tengah (Kalteng) Agustiar Sabran-Edy Pratowo kokoh di puncak jelang pencoblosan 27 November 2024.
""Dalam simulasi Surat Suara pasangan calon Gubernur-Wakil Gubernur Kalimantan Tengah, Agustiar Sabran-Edy Pratowo memperoleh angka elektabilitas sebesar 45,3 persen,"" kata Peneliti Poltracking Indonesia Masduri dalam paparannya, Sabtu (23/11).
Sementara paslon Nadalsyah Koyem-Supian Hadi berada di posisi kedua dengan elektabilitas sebesar 23,5 persen. Posisi ketiga yakni Willyu Midel Yoseph-Habib Ismail bin Yahya dengan 20,6 persen.
""Posisi kedua dan ketiga bersaing ketat, ada pasangan Nadalsyah Koyem-Supian Hadi dengan 23,5 persen dan Willy Midel Yospeh-Habib Ismail bin Yahya dengan 20,6 persen,"" ujar Masduri.

Sementara itu, paslon nomor urut 4 yakni Abdul Razak-Sri Suwanto menjadi paling bontot di angka 4,7 persen.
Dengan hasil survei tersebut, menjadi bukti kekuatan Agustiar-Edy yang semakin digdaya menjelang pemilihan. Keduanya semakin potensial untuk memenangkan pertarungan Pilgub Kalteng 2024.
Temuan survei Poltracking Indonesia dilakukan pada tanggal 14 - 20 November 2024. Sampel pada survei ini adalah 1200 responden dengan margin of error +/-2.9 persen.

Ada tingkat kepercayaan 95 persen. Klaster survei menjangkau 14 kabupaten/kota di Kalimantan Tengah secara proporsional berdasarkan data jumlah Daftar Pemilih Tetap (DPT) 2024, sedangkan stratifikasi survei ini adalah proporsi jenis kelamin pemilih.
Pengumpulan data dilakukan oleh pewawancara terlatih melalui wawancara tatap muka dengan menggunakan teknologi aplikasi terhadap responden yang telah terpilih secara acak. Setiap pewawancara mewawancarai 10 responden untuk setiap satu desa/kelurahan terpilih.",nasional
Cagub Jatim Luluk Hamidah Klaim Unggul Survei Versi Media Sosial," Sabtu, 23 Nov 2024 23:10 WIB ","Calon gubernur Jawa Timur nomor urut 1 Luluk Nur Hamidah mengungkapkan rasa terharunya atas respons positif masyarakat Jatim kepadanya. Ia pun mengeklaim unggul di sejumlah survei versi media sosial.
Selama masa kampanye, kata Luluk, ia dan Lukmanul Khakim gencar membicarakan solusi yang bisa menjawab persoalan Jatim. Salah satunya tentang pemerataan ekonomi demi memperpendek jarak kesenjangan sosial masyarakat desa dengan perkotaan.
""Terakhir kami ini kampanye, ya, respons masyarakat luar biasa. Awalnya terkejut, tapi keterkejutan itu justru menimbulkan rasa ingin tahu. Setelah mereka tahu, mereka jatuh cinta. Itu yang kami rasakan dan dibuktikan dari berbagai survei, baik internal maupun yang dirilis media,"" kata Luluk di Jombang, Sabtu (23/11).
Luluk mengatakan, ide dan gagasannya ternyata membuahkan hasil, ia menuturkan elektabilitasnya bersama Lukman mengalami tren positif dilihat dari berbagai survei di media sosial.

Menurut Luluk, hal ini menjadi indikasi bahwa masyarakat Jatim menginginkan perubahan nyata, terutama terkait pemerataan pembangunan dan pengentasan kemiskinan.
""Di media sosial, survei-survei hampir selalu menunjukkan kemenangan kami. Itu menunjukkan harapan masyarakat bahwa Jatim akan ada perubahan dan kemajuan, terutama dalam mengatasi kesenjangan yang masih sangat tajam,"" tambahnya.
Ia menjelaskan kesenjangan di Jatim tidak hanya terjadi antara wilayah perkotaan dan pedesaan, tetapi juga antara pusat pemerintahan dan daerah-daerah seperti Mataraman, Pantura, Tapal Kuda, dan Madura. Wilayah-wilayah ini kerap merasa terpinggirkan dalam pembangunan.
""Daerah-daerah seperti Jombang, Madiun, Ponorogo, Ngawi, Pacitan, Trenggalek, serta wilayah Pantura, Tapal Kuda, dan Madura masih merasakan kesenjangan yang signifikan. Ini yang harus kita jembatani dengan pemikiran dan gagasan baru,"" kata dia.




Luluk menekankan solusi terbaik untuk mengatasi kesenjangan adalah dengan menghadirkan kepemimpinan baru yang lebih segar dan adaptif terhadap kebutuhan masyarakat.
Luluk-Lukman pun menawarkan program-program yang berfokus pada pengentasan kemiskinan dan pemerataan pembangunan di seluruh wilayah Jatim.
""Kami siap menawarkan gagasan-gagasan yang fresh untuk mempersempit jarak kesenjangan. Selain itu, kami juga berkomitmen untuk menuntaskan isu kemiskinan yang masih sangat tinggi di banyak wilayah,"" ucapnya.
Luluk juga menjanjikan gaya kepemimpinan yang dekat dengan masyarakat. Ia berjanji jika terpilih, dia akan lebih sering turun langsung ke masyarakat daripada hanya berdiam di kantor gubernur.
""Kami siap memimpin dengan jiwa baru, semangat antikorupsi, dan kepemimpinan yang dekat dengan masyarakat. Kantor gubernur akan kami pastikan menjadi kantor rakyat yang benar-benar menghadirkan solusi atas persoalan mereka,"" katanya.

Ia percaya bahwa Jatim membutuhkan perubahan yang mendesak untuk menghadapi tantangan-tantangan ke depan. Ia pun mengajak masyarakat memilih Luluk-Lukman 27 November demi terwujudnya provinsi yang lebih inklusif dan berkeadilan.
""Kami mohon doa restu kepada seluruh masyarakat Jatim. Kami siap memimpin dengan semangat baru untuk menjadikan Jatim lebih baik, merata, dan sejahtera,"" katanya.",nasional
KPK Dikabarkan OTT Sejumlah Pejabat di Bengkulu," Sabtu, 23 Nov 2024 22:39 WIB ","Komisi Pemberantasan Korupsi (KPK) dikabarkan melakukan operasi tangkap tangan (OTT) terhadap sejumlah yang diduga pejabat tinggi di lingkungan pemerintah daerah di Bengkulu.
Kapolresta Bengkulu Kombes Pol Deddy Nata membenarkan ada pemeriksaan yang dilakukan KPK di Mapolresta Bengkulu, Sabtu (23/11).
""Iya betul KPK, cuma untuk kegiatannya kita tunggu sebentar. Untuk jumlahnya saya belum tahu, kita tunggu saja dulu. Karena yang melakukan kegiatan bukan Polresta Bengkulu dan saya tidak tahu apa-apa kegiatannya, mohon rekan-rekan wartawan sabar dulu sambil menunggu perkembangan lebih lanjut,"" ujar dia di Kota Bengkulu.Ia mengatakan Polresta Bengkulu hanya melakukan pengamanan kegiatan, sedangkan untuk isi kegiatan yang dilakukan oleh KPK tersebut pihaknya tidak mengetahui.

""Nanti gini saja, kita tunggu perkembangan lebih lanjut saja. Kita tunggu berita lebih lanjut perkembangan situasinya. Jadi kan Polresta Bengkulu mengamankan kegiatan untuk apa isi kegiatan, ini kita menunggu waktu dulu, nanti baru ada keterangan lebih lanjut,"" terangnya.Dikutip Antara, pukul 16.00 datang dua unit mobil dengan plat nomor B 1506 TJS dan BD 1612 EK yang membawa empat orang yang dijaga ketat oleh Unit Samapta Polresta Bengkulu.Satu orang dibawa melalui Aula Endra Dharmalaksana Polresta Bengkulu dan tiga orang lainnya dibawa melalui lobi Polresta Bengkulu.
",nasional
