judul,tanggal,isi,kategori
"Rusia Pakai Rudal Nuklir ke Ukraina, Perang Dingin Bakal Terulang?"," Jumat, 22 Nov 2024 19:50 WIB ","Sejumlah pakar negara Barat memperingatkan ancaman Perang Dingin yang bisa kembali terjadi imbas peluncuran rudal baru Rusia, Oreshnik, yang disebut-sebut berkemampuan nuklir, ke Ukraina.
Direktur Proyek Informasi Nuklir di Federation of American Scientists, Hans Kristensen, mengatakan Rusia telah meluncurkan rudal balistik yang membawa beberapa hulu ledak dalam perangnya dengan Ukraina pada Kamis (21/11) lalu.

Rudal balistik dengan beberapa hulu ledak seperti ini dikenal dengan Multiple Independently targetable Reentry Vehicle (MIRV). Kristensen berujar MIRV tak pernah digunakan sebelumnya dalam pertempuran di negara mana pun.
""Sepengetahuan saya, ini pertama kalinya MIRV digunakan dalam pertempuran,"" kata Kristensen, seperti dikutip CNN.

Di masa Perang Dingin, MIRV dikembangkan untuk memungkinkan pengiriman beberapa hulu ledak nuklir dengan satu peluncuran. Serangan rudal Rusia di Dnipro, Ukraina, sementara itu tidak dipersenjatai hulu ledak nuklir, melainkan senjata konvensional.
Di era nuklir, rudal balistik menjadi dasar pencegahan para pihak yang berkonflik untuk meluncurkan nuklir.





Rudal balistik dirancang untuk digunakan sebagai senjata yang aman agar tidak ada pihak yang tersulut untuk melancarkan serangan nuklir.
Kendati demikian, situasi saat ini berbeda dengan di era nuklir. Alih-alih mencegah serangan nuklir, para pendapat menilai rudal balistik, terutama MIRV, dapat mengundang meletusnya serangan nuklir.
Kristensen berujar kapasitas MIRV begitu merusak sehingga eksistensinya sangat mengkhawatirkan.
MIRV bisa menjadi senjata serang pertama serta juga bisa menjadi target serang pertama.
Union of Concerned Scientists memaparkan ada dua skenario yang begitu erat dengan MIRV. Pertama, digunakan. Kedua, dimusnahkan.
Kedua skenario ini sama-sama berpotensi memperluas perang ke skala yang jauh lebih besar.
Di masa perang, akan lebih mudah bagi pihak yang berkonflik untuk menghancurkan beberapa hulu ledak sebelum diluncurkan ketimbang menembak jatuhnya.

Kendati begitu, ketika sedang kritis, menyerang lebih dulu menggunakan MIRV bisa menghasilkan kemajuan yang signifikan.
Serangan Rusia ke Dnipro pada Kamis telah menunjukkan betapa menakutkannya MIRV. Beberapa hulu ledak jatuh di sudut yang berbeda pada target. Setiap hulu ledak pun harus dikalahkan dengan roket anti rudal.
Meski bukan hulu ledak nuklir, penggunaan MIRV dalam operasi tempur konvensional seperti ini jelas akan menimbulkan kegelisahan baru di dunia.
Sebab ini merupakan penyimpangan terang-terangan dari doktrin pencegahan Perang Dingin yang telah berjalan selama puluhan tahun terakhir.",internasional
Israel Klaim Bunuh Komandan Pasukan Roket Jihad Islam Palestina," Jumat, 22 Nov 2024 19:15 WIB ","Militer Israel mengeklaim telah membunuh komandan pasukan roket milisi Jihad Islam Palestina (PIJ) di Jalur Gaza pada Jumat (22/11).
Dalam pernyataan pembaruan tentang perang, militer Israel menyatakan telah membunuh Khalid Abu Daqqa dalam serangan terbarunya di Gaza.


Dikutip Al Jazeera, Abu Daqqa digambarkan sebagai komandan unit roket kelompok bersenjata Jihad Islam Palestina (PIJ).

Militer mengatakan serangan presisi itu berlangsung pada Rabu pekan ini di Deir El Balah, Gaza tengah, dan menewaskan beberapa anggota milisi PIJ, termasuk Abu Daqqa.
Hingga kini, PIJ belum memberikan pengumuman terkait kematian anggotanya tersebut.
Israel masih terus melancarkan agresi brutalnya ke Jalur Gaza Palestina sejak Oktober 2023 lalu. Hingga kini, agresi yang dinilai bentuk genosida di zaman modern itu telah menewaskan lebih dari 44 ribu warga Palestina di Gaza.





Sebagian besar korban merupakan anak-anak dan perempuan.
Sampai saat ini upaya perundingan gencatan senjata antara Israel dan Hamas, milisi penguasa Jalur Gaza, masih mandek dan belum menemukan titik terang.
Dewan Keamanan Perserikatan Bangsa-Bangsa (PBB) pun gagal meloloskan draf resolusi terbaru berisikan desakan gencatan senjata segera tanpa syarat Gaza
Mahkamah Pidana Internasional (International Criminal Court/ICC) resmi mengeluarkan surat perintah penangkapan terhadap Perdana Menteri Israel Benjamin Netanyahu dan eks menteri pertahanannya, Yoav Gallant, Kamis (21/11).
Majelis Praperadilan ICC, yang terdiri dari Hakim yang menangani situasi di Palestina, memutuskan untuk menangkap Netanyahu dan Gallant atas dugaan kejahatan kemanusiaan dan kejahatan perang yang dilakukan keduanya di Jalur Gaza, Palestina.
",internasional
VIDEO: Momen Pertemuan Prabowo dan PM Inggris Keir Starmer," Jumat, 22 Nov 2024 19:00 WIB ","Presiden RI Prabowo Subianto melakukan pertemuan bilateral dengan PM Inggris Keir Starmer di London pada Kamis (21/11).
Starmer menyampaikan bahwa ia ingin meningkatkan kerja sama antara Indonesia dan Inggris dalam banyak hal.
Hal yang dibahas pada pertemuan itu mulai dari sektor ekonomi, perikanan, pendidikan, kesehatan hingga pertahanan.
Yang sangat di tekankan pada kemitraan ini adalah peningkatan perdagangan dan investasi.
Indonesia dan Inggris juga menaruh perhatian pada masalah iklim untuk mendorong transisi hijau Indonesia.",internasional
FOTO: Kerusakan Imbas Gempuran Rudal Nuklir Rusia Oreshnik di Ukraina,"Jumat, 22 Nov 2024 18:40 WIB",Presiden Vladimir Putin mengatakan pasukan Rusia telah menembakkan rudal balistik jarak menengah baru ke Ukraina yang dikenal dengan Oreshnik.,internasional
"Marah ke AS, Putin Pamer Serang Ukraina Pakai Rudal Nuklir Oreshnik"," Jumat, 22 Nov 2024 18:05 WIB ","Presiden Vladimir Putin memamerkan pasukan Rusia telah menembakkan rudal balistik jarak menengah baru ke Ukraina yang dikenal dengan Oreshnik.
Dalam pidato yang disiarkan televisi, Kamis (21/11), Putin mengatakan pasukannya telah menguji rudal jarak menengah hipersonik dalam serangan ke Ukraina sebagai respons atas tindakan agresif negara-negara NATO.

""Kami percaya bahwa kami punya hak untuk menggunakan senjata kami terhadap fasilitas militer negara-negara yang mengizinkan (Ukraina) untuk menggunakan senjata mereka terhadap fasilitas kami,"" kata Putin dalam pidatonya, seperti dikutip Al Jazeera.
Anatoly Matviychuk, seorang pakar militer Rusia, mengatakan rudal hipersonik antarbenua Oreshnik ini dapat membawa enam hingga delapan hulu ledak konvensional atau nuklir, seperti dikutip Reuters.
Ini merupakan pidato perdana Putin sejak Presiden Amerika Serikat Joe Biden memberi lampu hijau kepada Ukraina pada Minggu (17/11) untuk menggunakan Sistem Rudal Taktis Angkatan Darat (ATACMS) buatan AS guna menyerang beberapa target di dalam Rusia.
Izin itu diberikan Biden di saat kondisi Ukraina makin terdesak karena kehadiran pasukan Korea Utara yang membantu Rusia di Kursk serta karena serangan-serangan signifikan Kremlin di kota-kota timur Ukraina belakangan.





Menteri Luar Negeri Rusia Sergei Lavrov sudah menyatakan bahwa serangan Ukraina yang menggunakan ATACMS tersebut akan dianggap sebagai fase baru perang antara Rusia dan Barat.
Hal ini sejalan dengan peringatan Putin selama ini yang menyatakan bahwa penggunaan rudal jarak jauh apa pun ke wilayah Rusia akan dianggap sebagai perang terbuka dengan negara-negara NATO.
Mengenai serangan rudal Oreshnik, Presiden Ukraina Volodymyr Zelensky pada Kamis menyatakan bahwa Rusia telah menggunakan Ukraina sebagai tempat uji coba rudal baru. Berdasarkan penelitian para ahli, kata Zelensky, rudal tersebut tampaknya merupakan rudal balistik antarbenua.
Meski begitu, pejabat AS dan NATO menggemakan deskripsi Putin yang menyatakan bahwa rudal tersebut merupakan rudal balistik jarak menengah. Rudal itu memiliki jangkauan lebih pendek, yakni 3.000 sampai 5.500 kilometer.
Konflik Rusia-Ukraina belakangan semakin panas setelah Kyiv mengantongi izin dari sejumlah negara Barat untuk menyerang wilayah Rusia menggunakan senjata Barat.

Izin seperti ini belum pernah diberikan sebelumnya lantaran peringatan tegas Rusia atas perang terbuka.
Kendati begitu, melihat perkembangan perang, AS dan Inggris pun mulai menggenjot persenjataan bagi Ukraina.
Selain ATACMS, AS juga akan mengirimkan Ukraina dengan ranjau darat antipersonel. Ukraina, selain menggunakan ATACMS, juga telah menyerang wilayah Rusia menggunakan rudal Storm Shadow buatan Inggris.",internasional
"Jadi Buronan ICC, Netanyahu Dilarang Berhubungan dengan PBB"," Jumat, 22 Nov 2024 17:30 WIB ","Sekretaris Jenderal Perserikatan Bangsa-Bangsa (PBB), Antonio Guterres menyatakan dukungannya terhadap keputusan Mahkamah Kriminal Internasional (International Court of Justice/ICC) yang merilis surat penangkapan Perdana Menteri Israel, Benjamin Netanyahu dan mantan menteri pertahanannya, Yoav Gallant.
Hal ini juga telah dikonfirmasi oleh juru bicara Sekjen PBB, Stephane Dujarric. Ia mengatakan, Guterres akan menghormati semua keputusan ICC terkait perintah penangkapan Netanyahu dan Gallant.

""Sekretaris Jenderal (Antonio Guterres) menghormati pekerjaan dan independensi Pengadilan Kriminal Internasional,"" jelas Dujarric ketika ditanya oleh wartawan dilansir Middle East Monitor (MEMO).
Dujarric menambahkan, semua negara yang menjadi anggota ICC wajib mematuhi dan melaksanakan apa yang telah menjadi ketetapan hukum internasional, termasuk keputusan ICC dan hukum terkait lainnya. Oleh sebab itu, semua negara ICC wajib mematuhi putusan mereka untuk menangkap Netanyahu dan Galant.
""Secara umum, negara-negara anggota telah menandatangani berbagai perjanjian, organisasi, dan piagam. Jika Anda menandatanganinya, penting untuk memenuhi kewajiban. Namun, ini berlaku untuk semuanya,"" lanjut Dujarric.
Ketika diwawancara wartawan, Dujarric sempat ditanya soal kemungkinan PBB menangkap Netanyahu dan kehadiran sang PM Israel di pertemuan organisasi tersebut. Namun, Dujarric tak menjawab dengan gamblang pertanyaan itu.





Meski begitu, ia menegaskan bahwa seluruh pejabat PBB tidak boleh melakukan hubungan formal dengan siapa pun yang telah menjadi buronan ICC, termasuk PM Netanyahu dan pejabat Israel lain yang menjadi target penangkapan mahkamah tersebut.
""Setiap perjalanan yang dilakukan oleh siapa pun yang didakwa oleh ICC juga akan melibatkan negara tempat konferensi PBB atau kantor pusat PBB berada. Aturannya adalah tidak boleh ada kontak apa pun antara pejabat PBB dan individu yang menjadi sasaran surat perintah penangkapan,"" lanjut Dujarric.
Namun, kata dia, dalam keadaan darurat, pejabat senior PBB punya hak melakukan hubungan dengan seorang yang telah menjadi buronan ICC.
Dujarric sendiri menolak menyebut agresi Israel di Gaza sebagai tindakan genosida. Namun, menurutnya, semua pejabat PBB sangat menyayangkan akan apa yang dilakukan Negeri Zionis di Gaza saat ini.

""Semua pejabat PBB, termasuk sekretaris jenderal dan Komisioner Tinggi untuk Hak Asasi Manusia, menurut saya, telah sangat jelas dalam keprihatinan mereka tentang pelanggaran dan pelanggaran mencolok hukum internasional yang telah kita lihat,"" kata Dujarric.
Sebelumnya, ICC mengeluarkan surat perintah penangkapan Perdana Menteri Israel Benjamin Netanyahu dan mantan Menteri Pertahanan Israel Yoav Gallant pada Rabu (20/11).
Surat perintah ini dikeluarkan menyusul tindakan agresi Israel di Gaza yang hingga kini belum berhenti.
""[Pengadilan] mengeluarkan surat perintah penangkapan untuk dua orang, Tn. Benjamin Netanyahu dan Tn. Yoav Gallant, atas kejahatan terhadap kemanusiaan dan kejahatan perang yang dilakukan setidaknya sejak 8 Oktober 2023 hingga setidaknya 20 Mei 2024, hari ketika penuntutan mengajukan permohonan surat perintah penangkapan,"" demikian pernyataan ICC.



Pengadilan Kriminal Internasional (ICC) mengeluarkan perintah penangkapan PM Israel Benjamin Netanyahu atas kejahatan perang di Gaza.",internasional
Eks Presiden Brasil Jair Bolsonaro Didakwa Rencanakan Kudeta," Jumat, 22 Nov 2024 16:55 WIB ","Kepolisian Federal Brasil mendakwa mantan Presiden Jair Bolsonaro dan 36 orang lainnya atas dugaan upaya kudeta, Kamis (21/11).
Bolsonaro dan puluhan pendukungnya didakwa karena diduga berencana melakukan kudeta terhadap Presiden saat ini, Luiz Inácio Lula da Silva.

Upaya itu diduga hendak dilancarkan pasca pemilihan presiden (pilpres) Brasil pada Oktober 2022 lalu.
Menurut polisi federal, Bolsonaro terlibat dalam gerakan penolakan hasil pilpres yang berujung pada kerusuhan di Brasilia pada Januari 2023. Saat itu, para pengunjuk rasa berniat menciptakan kekacauan untuk membenarkan kudeta militer.

Setelah melakukan penyelidikan selama ini, polisi pun mengeklaim menemukan bukti bahwa Bolsonaro mengetahui plot upaya kudeta tersebut. Ia dan 36 orang loyalisnya dituduh berbagi peran untuk menjalankan beberapa tugas, di antaranya menyebarkan disinformasi serta menghasut militer untuk ikut upaya kudeta.

Dalam dakwaan ini, 36 orang yang ikut terseret bersama Bolsonaro sendiri yakni para pendukung setia sang eks Presiden. Mereka di antaranya eks Menteri Pertahanan Walter Braga Netto, mantan Penasihat Keamanan Nasional Augusto Heleno, mantan Komandan Angkatan Laut Almir Garnier Santos dan mantan Menteri Kehakiman Anderson Torres.
Kepolisian menyatakan laporan penyelidikan ini telah diserahkan kepada Mahkamah Agung. Mahkamah Agung sementara itu menyebut akan menyerahkan laporan tersebut kepada Kejaksaan Agung pada pekan depan.
Kejaksaan Agung yang nantinya memutuskan apakah akan mengajukan tuntutan terhadap Bolsonaro dan 36 orang tersebut, demikian dikutip Reuters.
Merespons dakwaan ini, Bolsonaro dalam unggahan di X mengaku belum melihat dakwaan terhadapnya itu. Ia memilih untuk menunggu pengacaranya.
Bolsonaro selama ini telah membantah bahwa dirinya berniat untuk tetap berkuasa usai pilpres 2022 memenangkan Lula.
""Ini tentu saja akan dibawa ke Kantor Kejaksaan Agung. Perjuangan dimulai di Kantor Kejaksaan Agung. Saya tidak bisa berharap apa pun dari tim yang menggunakan kreativitas untuk mencela saya,"" tulisnya mengutip wawancara yang dilakukannya dengan surat kabar daring Brasil, Metrópoles, demikian dikutip CNN.



",internasional
"ICC Rilis Surat Penangkapan, Netanyahu Jadi Buronan 124 Negara"," Jumat, 22 Nov 2024 16:20 WIB ","Perdana Menteri Israel Benjamin Netanyahu menjadi buronan 124 negara usai Mahkamah Pidana Internasional (International Criminal Court/ICC) resmi merilis surat penangkapannya pada Kamis (21/11).
Selain Netanyahu, ICC juga memaparkan mantan Menteri Pertahanan Israel, Yoav Gallant, turut menjadi subjek penangkapan mahkamah tersebut.

""[Pengadilan] mengeluarkan surat perintah penangkapan untuk dua orang, Tn. Benjamin Netanyahu dan Tn. Yoav Gallant, atas kejahatan terhadap kemanusiaan dan kejahatan perang yang dilakukan setidaknya sejak 8 Oktober 2023 hingga setidaknya 20 Mei 2024, hari ketika Penuntutan mengajukan permohonan surat perintah penangkapan,"" demikian pernyataan ICC.
Dalam pernyataan itu, ICC meyakini Netanyahu dan Gallant ""memikul tanggung jawab pidana"" atas kejahatan perang, kejahatan terhadap kemanusiaan berupa pembunuhan dan penganiayaan, serta tindakan tidak manusiawi lain bersama pihak lain yang terkait.

Israel, yang bukan merupakan negara anggota ICC, menolak mentah-mentah surat penangkapan Netanyahu dan Gallant ini. Netanyahu sendiri menuduh ICC telah melakukan tindakan anti-Semitisme dengan merilis surat penangkapannya tersebut.






""Keputusan anti-Semit dari Pengadilan Kriminal Internasional sebanding dengan pengadilan Dreyfus di zaman modern - dan akan berakhir dengan cara yang sama,"" kata Netanyahu dalam sebuah pernyataan, mengutip AFP, Kamis (21/11).
Pengadilan Dreyfus mengacu pada peristiwa Alfred Dreyfus pada abad ke-19, ketika seorang kapten tentara Yahudi secara keliru divonis bersalah atas tuduhan pengkhianatan di Prancis.
Dengan keputusan ini, Netanyahu dan Gallant menjadi buronan di 124 negara anggota ICC.
Meski Israel bukan negara anggota ICC, Netanyahu tetap bisa ditangkap jika mengunjungi salah satu dari 124 negara anggota ICC.

Menurut Statuta Roma, semua keputusan yang telah diambil ICC harus dipatuhi oleh seluruh negara yang menjadi anggotanya. Dengan kata lain, keputusan ICC untuk menangkap Netanyahu dan Gallant harus dipatuhi oleh negara-negara anggota ICC.
Saat ini, ICC tercatat punya sekitar 124 negara anggota. Dari jumlah tersebut, 42 negara berasal dari kawasan Eropa, 33 dari Afrika, 29 dari Amerika, dan 20 lainnya berasal dari kawasan Asia-Pasifik.
Oleh karena itu, menurut pengacara ICC, Jonathan Kuttab, semua negara tersebut bisa menangkap Netanyahu dan Gallant jika kedua atau salah satu dari mereka berada di sana. Sebab, sebagai anggota, semua negara tersebut harus mematuhi segala ketentuan dari ICC.",internasional
"'Tertidur' 800 Tahun, Gunung Api Islandia Meletus 7 Kali dalam Setahun"," Jumat, 22 Nov 2024 15:45 WIB ","Sebuah gunung merapi di Semenanjung Reykjanes Lyings, Islandia barat daya, dilaporkan sudah mengalami erupsi untuk ke-7 kalinya sepanjang 2024 ini.
Menurut keterangan Kantor Meteorologi Islandia, erupsi kembali terjadi pada Rabu (20/11) malam waktu setempat. Letusan ini dilaporkan menimbulkan keretakan dan menyemburkan lava panas sepanjang 3 kilometer dari lokasi erupsi.

Pejabat Islandia mengatakan, letusan gunung api di Semenanjung Reykjanes yang terjadi Rabu tidak separah letusan yang terjadi pada Agustus lalu. Sebab, kata mereka, letusan kali ini sudah 'mencapai puncaknya'.
Mereka juga menambahkan bahwa letusan gunung tersebut tidak menimbulkan efek yang signifikan, seperti mengganggu aktivitas penerbangan dan aktivitas warga.

Dilansir Euro News, bandara internasional utama Islandia, Bandara Keflavík, mengatakan dalam sebuah pernyataan di situs webnya bahwa aktivitas 'penerbangan tidak terpengaruh' oleh letusan gunung Reykjanes.

Selain itu, mereka juga mengatakan bahwa tidak ada infrastruktur penting di bandara yang rusak imbas letusan gunung tersebut.
Meski begitu, imbas letusan ini, Spa Panas Bumi Blue Lagoon, salah satu tujuan wisata paling populer di Islandia yang ada di dekat gunung api di Semenanjung Reykjanes, harus ditutup sementara waktu.
Sebab, sebagian area di tempat wisata tersebut, termasuk tempat parkir kendaraan, dilaporkan sudah tertutup oleh lava.
""Kami mengamati dan menilai situasi yang berkembang. Ini adalah tantangan baru yang harus kami hadapi, yang mengharuskan kami mengevaluasi pilihan-pilihan kami untuk melangkah maju,"" kata manajer penjualan dan operasi Spa Panas Bumi Blue Lagoon, Helga Árnadóttir.

Gunung berapi di Semenanjung Reykjanes sebetulnya sudah 'tertidur' selama sekitar 800 tahun. Namun, Badan Geologi Islandia melaporkan bahwa gunung tersebut tiba-tiba kembali aktif pada 2021.
Sejak saat itu, letusan gunung api di daerah tersebut semakin sering terjadi. Para ahli juga telah memperingatkan bahwa gunung api Reykjanes kemungkinan akan mengalami letusan berulang selama beberapa dekade ke depan.",internasional
"Gunung Ibu Erupsi Lagi, Keluarkan Sinar Api Setinggi 350 Meter"," Minggu, 24 Nov 2024 12:42 WIB ","Gunung Ibu di Kabupaten Halmahera Barat, Maluku Utara, kembali mengeluarkan sinar api setinggi 350 meter di atas puncak gunung pada Minggu (24/11) dini hari sekitar pukul 00.55 WITA.
""Iya, benar keluarkan sinar api yang teramati setinggi kurang lebih 350 meter saat erupsi,"" kata petugas Pos pengamatan Gunung Ibu di Kabupaten Halmahera Barat, Richard Chaniago dalam keterangan tertulis yang dipantau dari Ternate.

Gunung Ibu kembali erupsi dengan mengeluarkan kolom abu setinggi 800 meter di atas puncak dan kolom abu teramati berwarna kelabu dengan intensitas tebal condong ke arah Barat Daya.
Dia mengatakan erupsi ini berhasil terekam di seismogram dengan amplitudo maksimum 28 mm dan durasi ± 1 menit 40 detik dari Pos PGA Ibu di Desa Gam Ici, Kecamatan Ibu.
""Sebelum mengeluarkan sinar api setinggi 350 meter, pada pukul 00.03 WIT juga mengeluarkan sinar api setinggi kurang lebih 300 meter dari atas puncak gunung,"" ujarnya seperti dikutip Antara.
Dia menjelaskan, bahwa saat ini kondisi gunung api setinggi 1.325 meter dari permukaan laut itu kini masih berstatus Level III atau Siaga.
Oleh karena itu, masyarakat di sekitar Gunung Ibu serta pengunjung atau wisatawan diminta untuk tidak beraktivitas di dalam radius 4 kilometer dan perluasan sektoral berjarak 5 kilometer ke arah bukaan kawah di bagian utara dari kawah aktif gunung tersebut.

""Jika terjadi hujan abu, masyarakat yang beraktivitas di luar rumah disarankan untuk menggunakan masker dan kacamata, agar mereka bisa terhindar dari paparan abu gunung itu,"" ujarnya.
Selain itu, kata dia, seluruh pihak untuk menjaga kondusivitas suasana di masyarakat, tidak menyebarkan narasi bohong dan tidak terpancing isu-isu yang tidak jelas sumbernya serta masyarakat, agar selalu mengikuti arahan dari Pemerintah Daerah.
Dia menambahkan, pemerintah Kabupaten Halmahera Barat agar senantiasa berkoordinasi dengan Pusat Vulkanologi dan Mitigasi Bencana Geologi di Bandung atau dengan Pos Pengamatan Gunung Api Ibu di Desa Gam Ici untuk mendapatkan informasi langsung tentang aktivitas Gunung api itu.",nasional
FOTO: Banjir Bandang di Sibolangit Tewaskan 3 Warga,"Minggu, 24 Nov 2024 12:32 WIB","Banjir bandang menerjang Desa Martelu dan Desa Sala Bulan di Kecamatan Sibolangit, Kabupaten Deliserdang, Sumatera Utara (Sumut) pada Sabtu (23/11).googletag.cmd.push(function() { googletag.display('div-gpt-ad-1621402367069-0'); });",nasional
OTT di Bengkulu Diduga Terkait dengan Pungutan buat Pilkada," Minggu, 24 Nov 2024 12:08 WIB ","Operasi Tangkap Tangan (OTT) yang dilakukan KPK di Provinsi Bengkulu diduga berkaitan dengan pungutan untuk Pilkada 2024. Gubernur Bengkulu Rohidin Mersyah yang ikut dalam kontestasi Pilkada tahun ini diduga menjadi salah satu orang yang ditangkap.
""Pungutan ke pegawai untuk pendanaan pilkada sepertinya,"" ujar Wakil Ketua KPK Alexander Marwata saat dikonfirmasi melalui pesan tertulis, Minggu (24/11).

Sebanyak tujuh orang terjaring tangkap tangan. KPK belum mengungkap identitas para pihak tersebut.
Tim penindakan KPK turut menemukan dan menyita sejumlah uang tunai yang masih dalam proses perhitungan.

""Turut diamankan sejumlah uang (masih dihitung),"" ucap Juru Bicara KPK Tessa Mahardhika Sugiarto.
Lembaga antirasuah akan menyampaikan detail kronologi OTT dan konstruksi kasus yang tengah diusut dalam konferensi pers sore atau malam hari ini.
""Lebih jelasnya nanti sore baru akan dipaparkan,"" lanjut Alex.
",nasional
Keluarga Kompol Ryanto Ulil Cap AKP Dadang Pengkhianat Polri," Minggu, 24 Nov 2024 11:50 WIB ","Pihak keluarga menyebut AKP Dadang Iskandar adalah pengkhianat di dalam institusi kepolisian, hingga berani menghabisi nyawa Kasat Reskrim Polres Solok Selatan, Kompol (anumerta) Ryanto Ulil Anshar.
Paman korban, Brigjen TNI Elphis Rudy meminta kepada Kapolri Jenderal Listyo Sigit untuk tidak kalah dengan pengkhianat Polri.

""Kami mohon jangan kalah dengan pengkhianat Polri, pengkhianat bangsa, pengkhianat rakyat, jangan kalah dengan produk gagal,"" kata Brigjen Elphis saat prosesi pemakaman di TPU Sir Na Pesse, Makassar, Minggu (24/11).
Brigjen Elphis menduga bahwa tersangka, AKP Dadang Iskandar sudah biasa menghilangkan nyawa orang tanpa ampun.

""Kenapa saya bilang produk gagal, karena saya yakin orang ini sudah sangat biasa melakukannya. Dengan mudahnya mengeksekusi tanpa ampun seorang yang tidak waspada, sudah sangat terbiasa, mungkin sudah melakukan seumur hidupnya,"" ungkapnya.

Meski demikian, Brigjen Elphis merasa bangga dengan sikap Kompol Ryanto Ulil yang tetap berpegang teguh pada prinsip dan integritas dalam menjalankan tugasnya sebagai anggota Polri.
""Kami bangga dengan integritasnya, kami sebenarnya sangat ikhlas. Kami pasrah, kami diajarkan untuk mengampuni,"" katanya.
Pihak keluarga tetap minta agar kasus ditegakkan seadil-adilnya dan memberikan hukuman yang setimpal bagi tersangka.

""Kami sudah mengampuni, namun demikian keluarga juga mengharapkan bahwa hukum tidak boleh tidak ditegakkan. Jangan sia-siakan pengorbanan ananda Ryan,"" pungkasnya.
Kasus polisi tembak polisi terjadi di Polres Solok Selatan, Sumatera Barat.
Kasat Reskrim Polres Solok Selatan AKP Ulil Ryanto Anshari ditembak mati oleh Kabag Ops Polres Solok Selatan AKP Dadang Iskandar, diduga berkaitan dengan bekingan tambang ilegal.
Hingga saat ini kasus masih dalam penyelidikan dan pelaku telah menyerahkan diri.",nasional
